{
  "schemaVersion": "1.0",
  "id": "experiencia-sig",
  "kind": "experience",
  "organization": "SIG Software e Consultoria em TI",
  "role": "Desenvolvedor de Sistemas — desenvolvimento e manutenção de funcionalidades do SIGAA",
  "start": "2016-06",
  "end": "2017-02",
  "currentAsOf": null,
  "areas": [
    "software-development"
  ],
  "responsibilities": [
    "Desenvolvimento e manutenção de funcionalidades do SIGAA, sistema acadêmico de terceiros.",
    "Trabalho em equipe com Java, Hibernate, JBoss e PostgreSQL; revisão de código e testes funcionais/manuais documentados."
  ],
  "stack": [
    {
      "name": "Java",
      "kind": "language",
      "usage": "documented",
      "evidenceLevel": "declared",
      "evidenceIds": [
        "catalog"
      ]
    },
    {
      "name": "Hibernate",
      "kind": "framework",
      "usage": "documented",
      "evidenceLevel": "declared",
      "evidenceIds": [
        "catalog"
      ]
    },
    {
      "name": "JBoss",
      "kind": "framework",
      "usage": "documented",
      "evidenceLevel": "declared",
      "evidenceIds": [
        "catalog"
      ]
    },
    {
      "name": "PostgreSQL",
      "kind": "database",
      "usage": "documented",
      "evidenceLevel": "declared",
      "evidenceIds": [
        "catalog"
      ]
    },
    {
      "name": "Scrum",
      "kind": "tool",
      "usage": "documented",
      "evidenceLevel": "declared",
      "evidenceIds": [
        "catalog"
      ]
    }
  ],
  "projects": [],
  "competencies": [
    {
      "name": "Experiência profissional documentada",
      "demonstrates": "Pedro Santos trabalhou como Desenvolvedor de Sistemas na SIG Software e Consultoria em TI de junho de 2016 a fevereiro de 2017, desenvolvendo e mantendo funcionalidades do SIGAA, sistema acadêmico de terceiros. Tecnologias documentadas DESTA experiência: Java, Hibernate, JBoss e PostgreSQL; colaboração, revisão de código e testes funcionais/manuais. NÃO atribuir essa stack à ACRUX (onde Java+H2+NetBeans estão documentados). A fonte disponível não identifica versões específicas de Java, nomes de módulos internos nem funções financeiras. Não afirmar autenticação, Git, JPA explícito, bugs específicos, autoria exclusiva ou módulos específicos sem comprovação. Código do SIGAA não está no GitHub pessoal, e ausência desse repositório não nega a experiência profissional.",
      "evidenceLevel": "declared",
      "evidenceIds": [
        "catalog"
      ]
    }
  ],
  "limitations": [
    {
      "topic": "Rastreabilidade do código profissional",
      "status": "not_documented",
      "description": "Atividades e tecnologias registradas no histórico profissional não implicam código público nem autoria exclusiva."
    }
  ],
  "evidence": [
    {
      "id": "catalog",
      "type": "portfolio_record",
      "url": "https://gbc.phasscode.com/#experiencia",
      "path": "knowledge/portfolio.json",
      "note": "Perfil profissional declarado e curado. Não tratar como commit do produto corporativo."
    }
  ],
  "sync": {
    "sourceRepository": null,
    "sourcePath": null,
    "sourceRef": null,
    "sourceCommit": null,
    "lastModifiedAt": null,
    "checkedAt": "2026-10-31T19:45:31.178Z",
    "analyzedAt": "2026-10-31T19:45:31.178Z",
    "reviewedAt": null,
    "verificationStatus": "catalog_only",
    "syncEligible": false
  }
}
